{
  "decisions": {
    "blocking": 0,
    "confirmed": 1,
    "informational": 0,
    "total": 2,
    "warning": 2
  },
  "findings": [
    {
      "category": "import/codeql",
      "confidence": "MEDIUM",
      "confidence_band": "MEDIUM",
      "confidence_breakdown": [
        {
          "code": "base_detection",
          "delta": 35,
          "text": "base: a scanner produced this finding"
        },
        {
          "code": "imported_evidence",
          "delta": 10,
          "text": "imported: an external scanner reported this finding (SARIF import)"
        }
      ],
      "confidence_reasons": [
        "+35 base: a scanner produced this finding",
        "+10 imported: an external scanner reported this finding (SARIF import)"
      ],
      "confidence_score": 45,
      "decision_policy": "enforced",
      "decision_reason": "actionable finding below the --fail-on threshold",
      "endpoint": "app/auth.py:57",
      "evidence": "This expression logs sensitive data (password) as clear text.",
      "fingerprint": "6f60ddce8b794132c0d7335da0dc64fa019a733a",
      "fingerprint_v1": "4985453a46d3f1acc976df431c325fad7adcac66",
      "fix": "",
      "id": "SEC-001",
      "line": "57",
      "occurrences": [
        {
          "endpoint": "app/auth.py:57",
          "fingerprint": "6f60ddce8b794132c0d7335da0dc64fa019a733a"
        }
      ],
      "references": [
        "CWE-312",
        "https://codeql.github.com/codeql-query-help/python/py-clear-text-logging-sensitive-data/",
        "rule:py/clear-text-logging-sensitive-data",
        "sarif-fingerprint:primaryLocationLineHash=2a4b6c8d0e1f3a5b:1",
        "tool:codeql@2.19.0"
      ],
      "rule_id": "py/clear-text-logging-sensitive-data",
      "severity": "MEDIUM",
      "source": "imported",
      "status": "WARN",
      "title": "Clear-text logging of sensitive information"
    },
    {
      "category": "injection",
      "confidence": "HIGH",
      "confidence_band": "HIGH",
      "confidence_breakdown": [
        {
          "code": "base_detection",
          "delta": 35,
          "text": "base: a scanner produced this finding"
        },
        {
          "code": "imported_evidence",
          "delta": 10,
          "text": "imported: an external scanner reported this finding (SARIF import)"
        },
        {
          "code": "imported_high_precision",
          "delta": 25,
          "text": "the source tool declares high precision for this rule"
        }
      ],
      "confidence_reasons": [
        "+35 base: a scanner produced this finding",
        "+10 imported: an external scanner reported this finding (SARIF import)",
        "+25 the source tool declares high precision for this rule"
      ],
      "confidence_score": 70,
      "decision_policy": "enforced",
      "decision_reason": "actionable finding below the --fail-on threshold",
      "endpoint": "app/views.py:102",
      "evidence": "This SQL query depends on a user-provided value. | Snippet: cursor.execute(f\"SELECT * FROM users WHERE id = {user_id}\")",
      "fingerprint": "c10aaed2762a35fce3434da254de8321dabf19b4",
      "fingerprint_v1": "177f68988e7db5d218825212a32333b6d5b5a464",
      "fix": "Use parameterized queries or an ORM instead of string concatenation.",
      "id": "SEC-002",
      "line": "102",
      "occurrences": [
        {
          "endpoint": "app/views.py:102",
          "fingerprint": "c10aaed2762a35fce3434da254de8321dabf19b4"
        }
      ],
      "references": [
        "CWE-89",
        "https://codeql.github.com/codeql-query-help/python/py-sql-injection/",
        "rule:py/sql-injection",
        "sarif-fingerprint:primaryLocationLineHash=8f1c9a2b7e3d4a5f:1",
        "tool:codeql@2.19.0"
      ],
      "rule_id": "py/sql-injection",
      "self_evident_signals": [
        "imported high-precision rule"
      ],
      "severity": "HIGH",
      "source": "imported",
      "status": "WARN",
      "title": "SQL query built from user-controlled sources"
    }
  ],
  "metadata": {
    "active_probes": false,
    "coverage": {
      "configured_complete": true,
      "contract_version": 1,
      "gaps": [],
      "limitations": [],
      "required_analyzers": [],
      "required_gaps": [],
      "retried": [],
      "strict": false
    },
    "duration": "\u003cnormalized\u003e",
    "endpoints_scanned": 0,
    "fingerprint_algorithm": "fendix/v2",
    "imports": [
      {
        "results": 2,
        "tool": "codeql",
        "version": "2.19.0"
      }
    ],
    "mode": "import",
    "policy_version": "1.0.0",
    "schema_version": 2,
    "started_at": "\u003cnormalized\u003e",
    "target": "",
    "version": "golden"
  },
  "sources": {
    "blackbox": 0,
    "correlated": 0,
    "whitebox": 0
  },
  "summary": {
    "critical": 0,
    "high": 1,
    "info": 0,
    "low": 0,
    "medium": 1
  },
  "total": 2
}
